id,biz-name,biz-phone,category ,sub-category ,location-post-code ,main-office-address ,email ,operating-hours ,abn,license-number ,services-provided ,Recommendation 
1,Hoppy's Plumbing,468461589,Plumbers ,,2328,Strathfield NSW 2328,hello@hoppysplumbing.com,24 hours ,50907943117,326759C,"Leak investigation, pumps installation and repair, water lines, dripping taps, burst and leaking pipe repairs, basement waterproofing, hot water tank replacement, leaking toliets, clearing blocked drians ",
2,Proud Plumbing,431080798,Plumbers ,,2211,Padstow NSW 2211,proudplumbing.au@gmail.com,24 hours ,97188954582,334045C,"Blockages, gas, general maintenance renovations, hot water service ",
3,Super Acts Plumbing Solutions,415211583,Plumbers ,,2148,40 Lancelot St Blacktown NSW 2148,,,19153072187,341659C,"Grey Water systems, Blocked drains, new drains, drain repairs, general maintenance, grease traps, rain water tank installation, home renovations, hot water unit repairs, hot water unit installation, new homes, toilet installation, toilet repairs, backflow systems, solar hot water, plumbing installation",
4,Insight Plumbing Group Pty Ltd ,1300467448,Plumbers ,,2251,Saratoga NSW 2251,info@insightplumbinggroup.com.au,24 hours ,86 635 766 371,,"Commercial plumbing, sewer repair and cleaning, toilet repair, tap repair, gas plumbing, blocked drain, hot water repairs",
5,AJM Plumbing Solutions ,483958132,Plumbers ,,2155,Rouse Hill NSW 2155,,24 hours ,59 654 504 784,,"Blocked Drains, Burst pipes, Gas fitting, Hot water unit repairs/replacements, Ducted heater repairs/replacement, Leak detection, Leaking taps, Toilet repairs/installation, Roof plumbing ",
6,RGB Plumbing Services ,410943582,Plumbers ,,2763,NSW 2763,,24 hours ,35 106 182 013,,"Tap installation, Tap repair, Plumbing leak detection, Plumbing pipe repair, Shower installation, Toilet installation, Toilet repair, Water heater installation, Plumbing leak repair, Leaking Taps",
7,Straight A Plumbing ,406604450,Plumbers ,,2155,Kellyville NSW 2155,andrew@straightaplumbing.com.au,24 hours ,63 837 859 545,,"Drain cleaning, Tap installation, Tap repair, Waster disposal instllation, Waste disposal repair, Outdoor plumbing system repair, Plumbing leak detection, Sewer repair, Plumbing pipe repair, Shower installation, Shower repair, Toilet installation, Toilet repair, Water heater installation, Water heater repair, 24/7 Emergency Plumbing Service, Burst/Leaking Pipes, Emergency Repairs, GAS instal, Gas Fitting Installation,",
8,Service Today Plumber the Ponds ,488814204,Plumbers ,,2212,Ponds NSW 2212,info@servicetoday.com.au ,24 hours ,87 168 659 247,,"General Plumbing, Hot Water, Blocked Drains, Leak detection, Gas Plumbing, Water filters, Emergency plumber",
9,All Plumbing Works ,435723389,Plumbers ,,2765,Riverstone NSW 2765,,24 hours ,53 626 910 487,257314C,"Plumbing Services, Drainage, Gasfitting, Hot Water Systems Installation, Excavation, and fixes for all other types of plumbing problems",
10,Plumbers Direct NSW ,1300877448,Plumbers ,,2155,184 Windsor road Kellyville NSW 2155,,24 hours ,67 139 962 413, 224298C,"Blocked drains, Toilet repais, Sewerage, Drain Inspections, Tap Repairs, Hot Water, Plumbing",
11,BDS Plumbing ,432299292,Plumbers ,,2200,Northam Avenue Bankstown NSW 2200,info@bdsplumbing.com.au ,24 hours ,28 146 857 012,,"High-Pressure Water Jetter, Camera Inspections Service, Sewer Cleaning, Repair & Replacement, Drainage Repair & Replacement, Burst Water Pipes, Leaking Taps/Toilets, Water Heater Repairs & Replacements, All Maintenance Plumbing, Commercial Plumbing, Real Estate Service, Excavating, Bathroom & Kitchen Renovations, Sewer Pump Repairs, Stormwater Pump Repairs",
12,Rainman Plumbing ,1300415161,Plumbers ,,2200,Sydney NSW 2200,,24 hours ,77 620 174 101,203244C,"Blocked drains, Backflow Prevention, Sewer Pipe Upgrades, Gas installations, Hot water systems, Leaking Tap, Tap &Toilet Repair, Thermostatic Mixing Values",
13,Supaman Plumbing Services ,455301415,Plumbers ,,2200,52/7-9 Cross st Bankstown NSW 2200,info@supamanplumbing.com.au,24 hours ,48 606 862 533,,"Drain Cleaning, Plumbing repairs, Plumbing installations and upgrades, Sinks, drains and faucets, Water filter installations, Bathtubs and showers, Water line repair and replacement, Toilets, Water Heater Installation, repair & replacement, Well Pumps, Whirlpool Tub Repairs, Garbage Disposals, Leak Detection and Repair, v",
14,Steadfast Plumbing Services ,451800644,Plumbers ,,2200,Bankstown NSW 2200,,24 hours ,39 660 541 560,,"Drain cleaning, Tap installation, Tap repair, Waster disposal instllation, Waste disposal repair, Outdoor plumbing system repair, Plumbing leak detection, Sewer repair, Plumbing pipe repair, Shower installation, Shower repair, Toilet installation, Toilet repair, Water heater installation, Waer heater reapir, Bathroom renovator, Gutter cleaning, Plumbing fixture installation, Remodelling, Water fixture repair",
15,Sydney 247 Plumbing ,452515272,Plumbers ,,2200,Bankstown NSW 2200,,24 hours ,90 892 694 604,,"Bathroom renovator, Plumbing, Gas Fitting ",
16,Auto King Mobile Mechanics ,1300291899,Car Mechanics,,2060,Sydney North shore NSW 2060,,7 am to 5 pm ,40 691 291 837,,"Mobile Safety Certificates, Mobile Pre-purchase Inspections, Mobile Car servicing, Mobile car repairs ",
17,Northwest Car Care ,296517840,Car Mechanics,,2158,Unit 6/915 Old Northern Rd Dural NSW 2158,,9 am to 4 pm ,15 717 837 790,,"Air and cabin filter replacement, Battery, Brake service & repair, Brakes, Electrical, Exhaust, Oil change, Tyres, Transmission, Wheel alignment ",
18,Blacktown Auto Services ,499910191,Car Mechanics,,2148,7 Chicago Avenue Blacktown NSW 2148,btownautoserv@internode.on.net,8 am to 6 pm ,14 071 026 223,,"Air and cabin filter replacement, Air conditioning, Battery, Brakes, ElectricalOil change, Steering and suspension repair, TransmissionVehicle engine diagnostic, A/C installation and repair, Auto detailingAuto glass repair, Carburetor cleaning, Electrical repair, Engine repair, ExhaustGeneral repairs & maintenance, TyresVehicle engine tuning, Vehicle interior vacuuming, Wheel alignment, All Makes And Models, Blue Slips, Old VehiclesRegistration Renewals, Diesel mechanics, egr, dpf cleanDash cam and reverse cam installations, New and used vehicle ceramic coating, Vehicle Pre purchase inspection, Routine Maintenance, Services & Repairs, any repairs on isuzu,hino and mitsubishi trucks, brown slips, pink slips and blue slipstruck engine repairs and gearbox repairs",
19,Automotive Professionals ,296802244,Car Mechanics,,2154,3/10 Hudson Avenue castle Hill NSW 2154,autoprof@hotkey.net.au,8 am to 4.30 pm ,17 057 572 228,,"Car servicing, Mechanical repairs, Registration Inspections, Four Wheel drive , Brakes ",
20,North Sydney Automotive ,299552629,Car Mechanics,,2060,32 Clark road North Sydney NSW 2060,service@northsydneyauto.com.au,8 am to 5.30 pm ,,,"Servicing, Brake replacement, Exhaust repairs, Rego Inspections, Steering & Suspension",
21,Em's Northshore Automotive ,299572559,Car Mechanics,,2060,66   72 Pacific Hwy North Sydney Entrance Via Bay 2 Middlemiss St. NSW 2060,workshop@quixspede.com,7.30 am to 6 pm ,61 092 262 274,,"Fault finding and diagnostics, car Safety inspections, ECU tuning and remapping, Service and Repairs, Battery, Tyre Service, Car Wash and detailing, child seat restraint fitting service, registration inspection, Walnut blasting, On Car Carbon Clean, Off Car Fuel Injection, A/C Service and repairs, APR approved workshop, Electronic tuning, Major mechanical repairs, maintenance servicing, Super Car servicing ",
22,TT Professional Auto Service ,299290069,Car Mechanics,,2060,"Unit 100/116 Miller st, North Sydney NSW 2060",,,,,servicing ,
23,Southwest Automotive ,246264521,Car Mechanics,,2560,Unit 1 12 Watsford Rd Campbelltown NSW 2560, info@southwestautos.com.au,7 am to 5 pm ,46 638 806 569,,"Logbook servicing, Europeon Car specialists, Autorised Child restraint fitting station, Brakes/Shock absorbers, Radiators &Cooling System, E-Safety Checks, Car Air Conditioning, Car Exhausts, Timing Belts, Waterpumps, New Car Batteries, Engine Management, Alternate and Starter Motors, Clutch Replacement, Fleet Work, Oil Leaks ",
24,Mobile car mechanic services ,424833431,Car Mechanics,,2200,Bankstown NSW 2200,,,,,Servicing ,
25,Equipt Mobile Mechanics ,404613747,Car Mechanics,,2137,Concord SYDNEY NSW 2137,info@equiptmobilemechanics.com.au,24 hours ,90 347 990 723,,"Logbook servicing, Suspension & Brake repair, Transmission & Service repair, Full Diagnostic Service, Clutch Replacement, Roadside Breakdowns ",
26,Carpenters Northern Beaches ,415951873,Carpenters ,,2099,5 Tasman Street Dee Why NSW 2099,michael@carpenternorthernbeaches.com.au,8 am to 6 pm ,,,"General carpentary and home repairs, Custom Cabinetry and storage solutions, Kitchen and Bathroom renovations, Timber flooring installations, Decks Pergolas and Outdoor Entertaiing Areas, Disabled Access & Mobility Modifications",
27,Northern Beaches Carpenters ,280958803,Carpenters ,,2100,6/2-4 William street Brookvale NSW 2100,,9 am to 5 pm ,34 156 111 143,,"Custom carpentry services, Remodelling, Building, Carpentry, Carpentry & Building, Residential carpentry, Residential Construction ",
28,Core Carpentry & Building ,418627213,Carpenters ,,2102,Warriewood Mona Vale NSW 2102,,7 am to 5 pm ,47 274 585 937,,"Custom carpentry services, Deck construction, Deck repair, Finish carpentry services, General carpentry and cabinetry services, Floor fittingInstallation, Remodelling, Building Decking, Building Work, Carpentry & Building, Carpentry Labor, Carpentry Work, CladdingFloor Installed, Framing, Framing Work, Hardwood Decking, Home Renovation, Plumbing, WorkRenovation, WorkRoof Framing, Small Renovation, Timber Flooring, Wall Frames, Deck Builder, Timber Decking",
29,SLR Constructions Carpentry ,413114201,Carpenters ,,2085,3 Wingara Grove Belrose NSW 2085,slrcons@optusnet.com.au,9 am to 5 pm ,90 513 524 882,40436,"General carpentry, Decking Construction and Renovation, Renovations and refurbishments, Renovations to existing structures, Balcony Installations, Decking Installations, Detailed Workmanship, Simple modern designs",
30,Trim Carpenters Pty Ltd ,437193883,Carpenters ,,2093,Manly Vale 2093,peter@trimcarpenters.com.au,8 am to 5 pm ,54 627 431 252,,"Heritage carpentry, Fine Carpentry, Construction, Design",
31,Advanced Craft Carpentry ,420313844,Carpenters ,,2033,Kensignton NSW 2033,info@advancedcraftconstruction.com.au,7 am to 5 pm ,43 706 132 886,207292C,"Doors & Frames, Decking and handrails, Joinery, Kitchen & Bathroom Renovations, Timber Floors & Stairs, Termites, maintenance",
32,South Sea Carpentry ,426831876,Carpenters ,,2517,85 Stephen dr Woonona NSW 2517,,7 am to 5 pm ,,,"Deck construction, Deck repair, Drywall installation, Exterior painting, Finish carpentry services, General carpentry and cabinetry services, Trim carpentry services, Composite decking, Deck builder, DeckingDoors, FlooringInternal fitout, Pergolas, Property maintenance, Renovations, Structural carpentry, Window installation, Wood decking",
33,Sydney Carpentry Group Pty Ltd ,420850850,Carpenters ,,2200,Bankstown NSW 2200,info@sydneycarpentrygroup.com.au.,9 am to 5 pm ,40 644 397 599,,"Framing, Partition Walls ",
34,Joinery Masters Pty Ltd ,415913937,Carpenters ,,2200,Unit 1/5 Homedale Rd Bankstown NSW 2200,sales@joinerymasters.net,8 am to 4 pm ,34 607 672 097,,Joinery & Kitchen appliance renovation,
35,Scarelli Joinery Pty Ltd ,297916922,Carpenters ,,2200,7 Arkley St Bankstown NSW 2200,admin@scarellijoinery.com.au,7 am to 5 pm ,23 086 936 834,,"Commercial Joinery, Residential Joinery, Carpentry ",
36,Patrick Walker Carpentry ,400184080,Carpenters ,,2769,Ivory St The Ponds NSW 2769,patrick@pwcarpentry.com.au,7 am to 5 pm ,55 101 234 746,,"Custom carpentry services, Installation, Decking, Pergola, Timber Flooring, Fixouts, Doors, Gates, BBQ Area, Cabinets Installing also all other carpentry works, Home projects ",
37,Pure Carpentry ,450523206,Carpenters ,,2097,Collaroy,,9 am to 5 pm ,98 205 564 220,,"Furniture assembly, Installation, Carpentry Glenhaven, Decking Glenhaven, Fitouts Glenhaven, Handyman Glenhaven, Pergolas Glenhaven",
38,Finesse Carpentry and Renovations ,490389447,Carpenters ,,2769,Ponds NSW 2769,,7 am to 5.30 pm ,81 636 114 184,,"architectural joinery, bathrooms, carpentry, concreting, custom furniture, decks, drawing plans, extensions, feature walls, floating shelves, gyprock, kitchens, maintenace, outdoor entertainment, outdoor living, pergolas, planning, plasterboard, renovations, repair, roofing, tiling",
39,Plateau Electrical ,299828668,Electricians ,,2097,78 Claudare St Collaroy Plateau NSW 2097,info@plateauelectrical.com.au,24 hours ,33 132 456 599,,"Fault Finding & Switchboard Upgrades, LED & Halogen Downlights, Ceiling Fan Installation & Replacement, Smoke Alarm Installation & Replacement, Pool Lights Installation & RepairsTV Wall Mounting, Underfloor Ventilation Fans, Dimmer Switch Installation",
40,ALL Electrical Plus ,1300350632,Electricians ,,2100,4 Kadigal Pl Beacon Hill NSW 2100,info@allelectricalplus.com.au,24 hours ,45 629 033 834,,"Residential, Commercial, Solar, Switchboard Installation, Data Cabling, Security Camera Installation, EV Charger",
41,Hello Electrical ,1300303077,Electricians ,,2085,27/19 Narabang Way Belrose NSW 2085,info@helloelectrical.com.au,24 hours ,65 638 317 334,,"Electrical repars, Electrical manintenance, Electrical installation, Electrical inspections, Electrical upgrades, Electrical fault finding, Electrical fitouts, 3 phase power installation, Power pole installation, Switchboard services, Consumer mains power seervices, Electricity meter services, Power, Lighting, Safety & security, Data, TV& commucications, Appliances & heating ",
42,Northern Beaches Electrical ,410421780,Electricians ,,2099,20/1-7 Boronia Street Dee Why NSW 2099,info@northernbeacheselectrical.com.au,24 hours ,33 886 714 976,,"General Light and Power Installations, Garden lighting and public area lighting, Stove & Over Fan and Element replacemnets, Electrical requirements for Commercial Air conditioning systems, Consumer Mians upgrades, Hot Water Elements and thormostats replaced, Data and telephone point installations, Pool and Spa electrical requirements, Pay TV and Free to Air TV Cabling, Emergency Lighting Installations and Audits and Maintenance, Earth Leakage Safety Switches, Commercial Rain Water Tanks, Borepumps,Control Panel Supply and Installations, Swtitchboard Upgrades and installation, Test and Tagging of appliances, fire and smoke detectors, Intercoms, Floor heating supply and controls C-Bus Automation systems",
43,NZM Electrical Services ,405070107,Electricians ,,2131,Ashfield NSW 2131,info@nzmelectrical.com.au,24 hours ,48 924 049 493,,"Residential electrician, Comercial electrician, Industrial electrician, Power point installation, Light installation, Free Electrical quote, fault finding, Switchboard upgardes, smoke alarm installation, 24 hour emergency electrician, Tesla Wall Connector installation, EV Charger installation ",
44,Bankstown Auto Electrics ,297964665,Electricians ,,2200,119 Canterbury Road Bankstown NSW 2200,,8 am to 5.30 pm ,87 063 633 367,,"Auto electrical repairs, Starter motor repairs, Alternator repairs, batteries, Air conditioning service/re-gas ",
45,Proud Bako Electrical and Solar services Pty Ltd ,478700570,Electricians ,,2200,Shop 17/83-99 North Terrace Bankstown NSW 2200,info@proudbakoelectrical.com,24 hours ,63 645 517 479,,"Electrical, Electrical repairs, New home installation, Solar panel installation, solar panel maintenance, switchboard and power points",
